{
  "$schemaRef": "fixtures/schema/safestart-hero-timeline.schema.json",
  "fixtureVersion": 1,
  "templateId": "safestart_dashboard_home_pre_kickoff",
  "screenFamily": "safestart-hero-timeline",
  "documentTitle": "Movemental - SafeStart Dashboard",
  "draftApiMapping": {
    "shell.tenantName": "organizations.display_name",
    "shell.userInitials": "users.avatar_initials",
    "page.supportingCopy": "engagements.safe_start.summary_markdown",
    "sections.timeline.stages": "engagements.milestones[]",
    "sections.rosterColumns.columns.items": "engagements.roles.participants[]",
    "shell.footerLinks": "navigation.footer_links[]"
  },
  "shell": {
    "brandLine": "MOVEMENTAL",
    "tenantName": "Northridge Community Center",
    "userInitials": "LO",
    "footerLinks": [
      {
        "label": "Help",
        "href": "#",
        "draftField": "support.help_url"
      },
      {
        "label": "Contact Josh",
        "href": "#",
        "draftField": "engagements.facilitator_contact_url"
      },
      {
        "label": "Sign out",
        "href": "#",
        "draftField": "auth.sign_out_url"
      }
    ]
  },
  "page": {
    "eyebrow": "SAFESTART DASHBOARD",
    "headline": "Welcome to your engagement.",
    "supportingCopy": "Your SafeStart engagement begins with a one-hour kickoff Zoom tomorrow at 10:00 AM Central with Joshua Shepherd. Below is what to expect over the next two weeks. Your dashboard will become more active after kickoff — for now, this page is your engagement summary."
  },
  "sections": [
    {
      "id": "timeline",
      "kind": "timeline",
      "stages": [
        {
          "stageLabel": "Stage 1",
          "title": "Engagement signed",
          "detail": "May 10, 2026",
          "state": "complete"
        },
        {
          "stageLabel": "Stage 2",
          "title": "Kickoff Zoom",
          "detail": "Tomorrow, May 12, 10:00 AM CT",
          "state": "current"
        },
        {
          "stageLabel": "Stage 3",
          "title": "Asynchronous review",
          "state": "upcoming"
        },
        {
          "stageLabel": "Stage 4",
          "title": "Revision Zoom",
          "state": "upcoming"
        },
        {
          "stageLabel": "Stage 5",
          "title": "Internal ratification",
          "state": "upcoming"
        },
        {
          "stageLabel": "Stage 6",
          "title": "Publication and rollout",
          "state": "upcoming"
        }
      ]
    },
    {
      "id": "rosters",
      "kind": "rosterColumns",
      "columns": [
        {
          "title": "YOUR CONTRIBUTORS",
          "items": [
            {
              "name": "Linda Ozawa",
              "subtitle": "Executive Director"
            },
            {
              "name": "Marcus Vance",
              "subtitle": "Director of Development"
            },
            {
              "name": "Sarah Kim",
              "subtitle": "Communications Director"
            },
            {
              "name": "James Brennan",
              "subtitle": "Director of Programs"
            },
            {
              "name": "Amelia Torres",
              "subtitle": "Chief Financial Officer"
            }
          ]
        },
        {
          "title": "YOUR DECIDERS",
          "items": [
            {
              "name": "Linda Ozawa",
              "subtitle": "Executive Director (signing)"
            },
            {
              "name": "The Northridge Board of Directors",
              "subtitle": "(ratifying)"
            }
          ]
        },
        {
          "title": "YOUR FACILITATOR",
          "items": [
            {
              "name": "Joshua Shepherd",
              "subtitle": "Founder & CTO, Movemental"
            }
          ],
          "aside": {
            "lines": [
              "Available during engagement:",
              "josh@movemental.ai",
              "(816) 555-0142"
            ],
            "draftField": "engagements.facilitator_contact_block"
          }
        }
      ]
    },
    {
      "id": "prep",
      "kind": "prepChecklist",
      "eyebrow": "BEFORE THE KICKOFF ZOOM",
      "title": "A few things to bring to the kickoff.",
      "intro": "The kickoff is one hour. We will use this time to align on objectives, confirm the timeline, and establish the operational cadence. Please be ready to discuss or provide the following during our session.",
      "bullets": [
        "Existing AI policy drafts (if any)",
        "Relevant Board documents from Q1",
        "Specific concerns regarding data privacy",
        "Current list of sanctioned AI tools",
        "Primary Donor/Board stakeholders"
      ]
    }
  ]
}